number,date,glider,launch_site,launch_time_utc,landing_site,landing_time_utc,track_distance,hikeandfly,comment,xcontest_url,xcontest_tracktype,xcontest_scored_distance,video_url
13,2013-01-26,Team5 Green,Crap Sogn Gion,10:00,Larnags,10:12,4,,,,,,
232,2021-03-31,Advance Xi 21,"Fanas, Eggli",10:53,"Grüsch, Feld",14:19,126.63,false,,https://www.xcontest.org/switzerland/de/fluge/details:dbrgn/31.3.2021/10:53,flat_triangle,50.99,
262,2021-08-20,Advance Xi 21,Clariden,10:56,Planurahütte,11:10,7.69,true,"Aufstieg auf den Clariden ab Klausenpass.

Wind von Südwest. Start ab Gipfel, anschliessend Soaring und Flug zur Planurahütte.

Landung bei der Planurahütte auf dem Windkolk neben einem Gletscherflugzeug.",https://www.xcontest.org/2021/switzerland/de/fluge/details:dbrgn/20.8.2021/10:56,free_flight,3.20,
